What do you call the person who signs a document on behalf of another?,Attorney in Fact,Power of attorney,Customer,Client,The person IS an attorney in fact.  S/he is that because s/he HAS the authority of a power of attorney document.
The agent presented an offer. On the contract, in the space for the buyer's name was written: "An undisclosed buyer." This would be an example of which type of principal?,Partially disclosed,Fully disclosed,Undisclosed,Illegal,Since the other party knows there IS a buyer, but not the identity of that buyer, that is partially disclosed.  Undisclosed would be if the agent was representing that the agent was the buyer, rather than an agent for another party.  Fully disclosed would be if the buyer was named.
M took a listing. Which of the following situations best describes the concept of designated agency? The contract states:,The broker and M will represent the seller.,The broker and all agents in the office will represent the seller.,The broker is a limited agent and M represents the seller.,All agents in the office will be designated as limited agents.,When a listing OR a buyer-agreement is first signed, we are only dealing with one party, so limited agency is only a possibility at this point. If everyone in the office represents the seller or buyer, that would be subagency.
The difference between present value and reproduction cost is:,depreciation,appreciation,market value,book value,If the appraiser uses the cost approach to determine the value of the improvement if it was built now, that amount needs to be depreciated to the age of the subject property.
An assessor is trying to determine the square footage of a property. He measures:,the outside dimensions.,inside, useable area.,the inside rooms including the closets.,the home, excluding hallways.,Memorize this one.
A particular house that was for sale had 60 amp service. The recommendation these days is for 100 amps. This is an example of:,Functional obsolescence,Physical deterioration,Economic obsolescence,Deferred maintenance,Economic obsolescence is factors outside the boundary of the property and outside the control of the owner.  Functional obsolescence is things that work, but nobody wants it.  You have electricity -- but it's not what people want these days.
Which of the following is NOT one of the essential elements of value?,Highest and best use,Scarcity,Demand,Transferability,DUST -- Highest and best use does not fit with the initials!  Highest and best use is the first principle of appraising.
Which of the following is NOT part of an appraisal?,A description of the neighborhood surrounding the property,Appraiser's best estimate of value,The date of the appraisal report,The signature of the appraiser,There are four parts to the appraisal. The one missing here is the date. On the URAR there is a place for neighborhood information, but it is not one of the four required parts to qualify as an appraisal.
When taking a listing, agent J had sellers who insisted their house was worth more than the one down the street for sale, even though both houses were basically the same. J explained that buyers won't pay any more than they have to in order to get what they desire. This is the principle of:,Substitution,Progression,Contribution,Balance,The question is a perfect description of the principle of substitution.  The other answers are all also principles.  If you're not familiar with them, it would be good to go back and review.
The Y Co. needed a large parcel of land to relocate their business. They found two parcels next to each other priced at $80,000 and $95,000 and purchased them both. Subsequently they found a better site and sold the two parcels to one buyer for $205,000. This illustrates the concept of:,Plottage,Neighborhood Cycle,Assemblage,Situs,The combined value of the two was $175,000.  If the single parcel had sold for that, it would have been assemblage.  But because the combined value was worth more, that is plottage.
The age of an improvement can be discussed from several viewpoints. Which would be considered to be the longest?,Physical life,Economic life,Effective life,Service life,It might not be economically viable, yet is still standing:  physical life.
Tom is asking $100,000 for his home. Kyle calls and offers $100,000 over the phone. Tom accepts the offer. This contract would be considered:,Unenforceable,Void,Unilateral,Voidable,It is a valid contract if it has the four essential elements, MCCL.  However, under the Statute of Frauds if either party wanted to take legal action against the other in court, it would be unenforceable.
A sales agent in Utah negotiated an offer on an old home which had problems with the electrical system. The agent did not make an inspection or suggest one be done. The seller says everything works. When the buyer asked, the agent said, "Everything's in good working order." The sales agent is guilty of:,Making a substantial misrepresentation,Nothing, because of the fiduciary relationship to the seller,Nothing, because of what the seller said,Nothing, because there was no intention of misrepresentation,The agent's duty is to look out for the client's interest.  This was an older home.  The agent should have urged the buyer, as part of due diligence, to have a home inspection done and not just relied on what the seller said.
A broker found a ready, willing, and able buyer to purchase seller Bond's house at the listing terms. Before agreeing to the sale, seller Bond introduced a new restriction stating that the sale could only be completed if the buyer agreed not to build a tennis court on the property. The buyer refused and withdrew from the negotiations. Is the broker entitled to a commission?,Yes, because the broker had fulfilled the listing contract and must be paid.,Yes, because the seller can change the terms in a listing agreement any time he wants.,No, because seller Bond never accepted the buyer's first offer.,No, because the buyer did not complete the purchase.,The contract says the commission is owed when the agent: 1) finds a ready, willing and able buyer, 2) at the seller's terms.  The offer was at the seller's terms.  The seller tried to change the terms AFTER the offer had been made.
The contract entered into between the principal broker of an office and the sales agents is usually which type of contract?,Unilateral,Bilateral,Defeasible,Qualified,It is unilateral because only the broker makes a promise -- to share a percent of commissions the agent brings in.  If he/she does not, the agent could sue.  The agent makes no such promises.
P, who is 25, did not realize Q was only 17, and entered into a contract with Q. P no longer wants to go through with the deal, but Q does. Which of the following statements apply?,P has no choice, but it is a voidable contract for Q.,The contract is valid and binding on both P and Q.,The contract is void if Q didn't have a co-signer.,This is definitely a voidable contract for P.,If you missed this, review the differences between valid, void, and voidable.  In a voidable contract only one of the parties has the right to choose:  either to affirm the contract or to walk away from it.
Certain defaults, unfortunately, happen quite often and so they are planned for and consequences outlined in the contract. An example is the earnest money deposit. This is:,Liquidated damages,Pur autre' vie,Hypothecation,Subrogated damages,Subrogated damages is a made-up term.  Pur autre' vie applies to life estates, and hypothecation is giving something as collateral without giving up possession.  The damages are "liquid," meaning you can get to them quickly.
A guarantee in a deed which says the grantor really does own the property and has the right to convey it to another is called the:,Covenant of Seizin,Covenant of Warranty Forever,Covenant Against Encumbrances,Covenant of Further Assurance,(Deeds & Transfer) Encumbrances covenant says there are no encumbrances except the ones disclosed; Further Assurance says the grantor will defend the title of the grantee, if necessary; Warranty Forever says the grantor will even buy it back, if necessary.
Which of the following statements is NOT applicable to a holographic will.,It cannot convey real property.,It can designate who will raise the minor children.,It can convey any kind of property.,,(Deeds & Transfer) This is a will in the handwriting of the testator (hence, "in writing"), and thus, can convey real as well as personal property.
A deed filed in the public records provides which of the following:,Constructive notice,Escheat,Statute of limitations,Actual delivery,(Deeds & Transfer) Actual delivery is giving the deed to the grantee.  Escheat pertains to dying without a will, and statute of limitations relates to contract law.
When someone makes a statement to a qualified official that they freely and voluntarily executed a deed or document:,Acknowledge,Certification,Recording,Habendum,(Deeds & Transfer) Recording is to record a document with the county recorder.  Habendum is a clause in a deed. With a notary public you acknowledge that you are signing of your free will and provide proof of who you are. A witnessed document also falls under the category of acknowledged.
A broker can be charged with violating the Sherman Antitrust Act if he/she says to a seller:,We can't possibly charge less than the rate establised through the multiple listing service.,Our company usually charges 6% for this type of listing.,The commission is fully negotiable between the broker and the seller.,We never discount the commission.,There can be no "set" commission established between brokerages, such as would be the case in the answer mentioning the MLS.
You present an offer from a qualified, willing and able minority buyer. The seller refuses to sell because the individual is a minority. You can legally do all the following EXCEPT:,Do not show this house to any other minorities.,Make the buyers aware they could possibly sue the seller.,Tell the owners they are in violation of Fair Housing Laws.,Inform HUD.,Refusing to show a property that is listed for sale or available for lease based on a person's race, religion, sex, national origin, or color is clearly specified as a violation of Fair Housing laws.
This ad appearerd in the newspaper. "Beautiful three bedroom home in Hispanic neighborhood. Owners moving to neighboring state. Purchase price $80,000, APR 6.5%." This ad would violate which of the following laws?,Federal Fair Housing,Truth in Lending,Interstate Federal Full Disclosure Act.,RESPA,You cannot advertise in a way that targets a specific protected class.
A new apartment building was constructed with an elevator. Under the Fair Housing Amendment Act of 1988, what would the owner have to do.,Make sure thermostats in all rooms are reachable from a wheelchair.,Adapt all kitchens with sink, stove, etc. low enough for wheelchair use,Make all hallways and doorways extra wide.,Not have a "No Pets" rule in case a blind person rented one unit.,The thermostat issue has to do with two things:  1) there is an elevator so all units are accessible; therefore, 2) thermostats and electrical outlets have to be placed for ease of access by someone in a wheelchair.
M starts a small business teaching people how to do unique types of quilting and stitchery and hires one person to help her. She finds an old house to rent cheaply. It only has one very small 1/2 bath, and five steps to get in the front door. In this case, ADA requirements:,are violated because a handicapped person would not have equal access.,do not apply since there's only one employee.,only apply when there are more than 15 employees.,don't apply as it would be too costly for a small business to make major construction modifications.,Since there aren't 15 employees it does not apply relevant to hiring practices.  But the equal access issues to get in, and to have access to a bathroom do apply.
A subordination clause in a loan would involve which of the following actions?,Alteration of priority,Assignment to a new borrower,Abandonment by the borrower,Abrogation,(Loan Types) To become subordinate is to have a lower position, thus altering priority of a previous lien.  Abrogation is a term that applies to title insurance.
A builder buys a lot and obtains a loan to build a "spec house." What type of loan would he have?,Construction,Blanket,Wraparound,Graduated,A blanket loan uses two or more parcels for security.  A wraparound has an underlying loan.  A graduated loan has terms in it indicating when and by how much the payments will increase over time.
In a loan, an alienation clause:,Protects the mortgagee's position,Protects against illegal aliens obtaining valid ownership,Insures that there will be no late payment of principal,Insures taxes will be paid,(Loan Types) The alienation clause says the loan will be paid off if the property is sold.  My son just got a loan for 4.5%.  Time passes and rates go up to 15%.  The lender wants protection that when the house is sold the new buyer will have to get a new loan at current rates, not keep the 4.5% going.
When a lender confirms a specific loan amount and agrees to the interest rate, this process is referred to as a(n):,Lock,Disclosure,Origination fee,Interest insurance,A premium is paid to lock the rate so if it goes up before closing on the deal, the borrower still gets the lower rate.  Without a lock, the borrower takes his/her changes.
Which arrangement may occur in a typical construction loan?,Funds are paid in installments at various stages of construction.,Funds are given after construction is completed.,The full loan is advanced before construction begins.,Interest on the total amount of the loan is charged from the beginning.,By paying out the loan amount in small increments as the funds are needed it reduces the lender's risk and reduces the interest needed to be paid by the builder.
A buyer wants to assume a loan without taking on any personal liability for the loan. In the purchase offer, relative to the loan he should state he will:,Take title on a "subject to" basis,Assume the loan and make the payments,Hypothecate and accelerate the loan,Subordinate to the seller's interest,(Loan Types) Anyone who has a loan has liability.  By taking title to the property on a subject-to basis, the existing loan stays in the seller's name.  A foreclosure or late payments wouldn't go against the buyer's name, but if the property gets foreclosed, it's the buyer's loss -- so there's no way out of that part of the liability.
Which of the following terms is NOT applicable to an adjustable rate mortgage?,Discount,Margin,Index,Cap,Discount in relation to loans applies when an investor buys an existing loan for less than its face value.
J carried back a 2nd mortgage when his home was sold. Now he needs some ready cash and is going to sell it to a secondary lender for 60% of face value. This discounting of the loan does NOT have which of the following advantages?,The person who bought the house and has the loan will now pay a higher interest rate.,It gets a lump sum of cash immediately for J.,It provides an increased yield for the secondary lender.,The secondary lender has a secured investment at relatively high interest.,The sale of an existing loan at a discount does not have any impact on the borrower.  If the face value is $10,000 and the holder sells it at a discount, he/she will receive less than $10,000 - but does get a lump sum of cash.  The investor who buys at a discount gets an increased yield.
E borrowed money from a bank for personal reasons. It had a fixed interest rate for a five year term. Monthly payments were interest only, and at the end, E owed the lender the full amount borrowed. This is which kind of loan?,Straight loan,Purchase money,Participation loan,Partially amortized loan,A partially amortized loan would have some of the balance paid off at the end.  A purchase money loan is seller financing.  A participation loan is one where the lender is also an owner.
If the loan to value ratio is too high, the lender will want mortgage insurance to protect its interest in case of default and foreclosure sale. In almost all cases, what is the number that triggers mortgage insurance being paid?,81%,95%,90%,75%,(Loan Types) 80% LTVR or lower does not require mortgage insurance.
A plat map is used in which type of legal description?,Lot and Block,Government survey,Rectangular survey,Metes & Bounds,If you remember its full name:  lot, block, and plat, you'll have no trouble with a question like this!
The relationship between the lessor and the lessee could be defined as which of the following?,tenancy for years,tenants in common,joint tenancy,life estate,(Leases) We aren't given any particulars about this lease agreement.  But three of the answers have to do with ownership and only tenancy for years is a lease, so that's the answer!
Which of the following is NOT true about a sale and leaseback of a commercial property?,Ownership does not actually transfer,Seller frees up funds,Buyer can deduct depreciation from his taxes,Seller is able to deduct rent payments from his gross income,(Leases) The key to these sale-leaseback questions is to translate terms like buyer and seller to their new roles now that the deal is done:  lessor, lessee.  Ownership does change hands.  That's why the first word in sale-leaseback is "sale."
An agent contacted an owner to see if they might want to sell the property. The agent said, "I think I can get you $250,000," which surprised the owner. The owner said, "Ok, and anything over that can be your commission." This is:,Is a net listing and could be grounds for disciplinary action against the agent.,A really good deal for the agent and the agent should jump on it!,Only legal if the agent ran comps and can justify the $250,000 number.,A perfectly good way for agents to market themselves and get listings.,This is pretty much self explanatory.  The listing contract must say up front what the listing price is and how much in dollars or percent the commission is going to be.
Agent G was going to leave XYZ Real Estate and go to ABC Realty. G's great-aunt had listed her house and wanted G to still be her agent. Which of the following answers would accomplish this in accordance with the law?,The broker of XYZ agrees to cancel the listing.,The listing is assigned from XYZ to ABC,Everything stays the same and G continues to service her aunt's listing.,The listing has to stay with XYZ and the aunt will be assigned a new agent.,This is an agency and a Utah Law issue.  Listings cannot be assigned.  So the only option is the correct answer.  By mutual agreement the current listing is terminated, then a new one is entered into at the new company.
The seller S was agreeable to listing the house and paying a commission if a real estate agent found a buyer. However, S wanted to be able to avoid a commission if a neighbor bought the house. What would accomplish this for S?,An exclusive agency contract.,An exclusive right-to-sell contract.,A single party exclusive right-to-sell.,A limited agency agreement.,Exclusive Agency contracts mean the seller will pay a commission if an offer is accepted by someone brought by a real estate agency.  If the seller finds his/her own buyer, no commission is paid.
Who gives the lender the mortgage and note?,The mortgagor,The trustee,The mortgagee,The fiduciary,(Mortgage Law) The only two answers you should consider are mortgagor or mortgagee.  First translate the word mortgage.  It is not the loan, but the security for the loan.  Who gives the security?  The OR person, or the mortgagor gives the mortgage as security.
What is the right of a mortgagor to regain clear title to the property upon full payment of the debt after the foreclosure sale?,Redemption,Reinvestment,Reversion,Release,(Mortgage Law) The word "redeem" means to save.  To save the property from being lost to the defaulting borrower, payment in full would have to be made.
When the buyer purchased the property using a Uniform Real Estate Contract, what is the interest of the buyer called?,Equitable interest,Title,Deed,Possession interest,(Mortgage Law) Because, under this contract, the deed is not conveyed to the buyer until the loan is paid off, the title is divided into two parts:  equitable and legal.  The seller/lender holds legal title and the buyer/borrower has equitable title.
The phrase "the primary evidence of a loan" best describes:,The promissory note,The trust deed,The defeasance clause,The mortgage document,(Mortgage Law) The promissory note is the evidence that a loan exists.  The trust deed or mortgage is the security or collateral for that loan.
A lender, as security for a loan, has the right to force the sale of the property to recover the amount owed. But if more than the loan and costs amount is recovered, the excess goes back to the borrower. This is:,Lien theory,Title theory,Mortgage theory,Hypothecation theory,(Mortgage Law) In title theory states the lender owns the property, therefore would be entitled to any profits.  In lien theory, the lender is entitled to loan payoff (and costs of foreclosure), but any profits are the defaulting borrowers.
In the list below, which item does NOT belong with foreclosure under a trust deed?,Statutory period of redemption,Equitable period of redemption,Special warranty deed,Three months,(Mortgage Law) The statutory period of redemption is the six months after the sale when the defaulting borrower can pay everything and redeem the property.  It applies to mortgage foreclosure.
R sells property to T with the restriction in the sales agreement that T can only use the property for farming purposes. This is an example of:,Fee simple defeasible,Fee simple with a condition precedent,Deed in lieu of . . .,Fee remainder estate,There was no condition before (precedent) the granting of the deed. Deed in lieu of . . . Is a "friendly foreclosure." Anything talking about remainder interests involves a life estate.  This situation is defeasible (translate defeatible).  If the new owner stops farming, it goes back to the seller.
Four brothers own a property as joint tenants. It has appreciated quite a bit in value since they made the investment to buy it. One brother wants to sell and get his money out, and he has a ready, willing and able buyer. The others refuse to sign the offer. What is a possible legal solution?,A partition action,An estate pur autre'vie,A writ of execution,Exercise the defeasance clause,An estate pur autre' vie belongs with a life estate. A writ of execution is given to the sheriff by the court to evict a tenant, and there is no defeasance clause involved in the situation described here.
G followed the steps of adverse possession, hoping to end up owning the property. Five years into it, he was transferred across the country. H picked up where he left off, completing the requirements to seven years. This is called:,Tacking,Abandonment,Severance,Subrogation,This has nothing to do with abandonment; severance is taking something that is real property and severing it, turning it into personal property.  Subrogation is a concept that belongs with title (or any other) insurance.
Willful destruction or neglect of property which affects the rights of the remainderman is:,Waste,Vandalism,Sufferance,Succession,(Loan Types) Waste comes from two directions:  a borrower who does not maintain the property, or a life estate holder who allows value (and therefore the interest of the remainderman) to depreciate.
A person lived on a property openly and notoriously under "color of title." This situation has to do with:,Adverse possession,Easement by prescription,Fee simple defeasible,An owner who holds a quit claim deed,Easement by prescription leads to continued use, but not ownership. Fee simple defeasible is ownership with strings attached.
Which of the following is an issue with trade fixtures?,Vital to the business function,Historical significance,Fits the decor theme,Physically attached,(Property) Trade fixtures may or may not be physically attached.  They are "attached" to the business itself, not the real property.
The Real Estate Purchase Agreement states that the refrigerator is to go to Jack, the buyer. How should Jack be able to show he owns the refrigerator?,Bill of Sale,The statement on the purchase agreement,A certificate of sale,The deed,Even thought the refrigerator is mentioned in the REPC, that does not convey the ownership.  A bill of sale transfers the ownership of personal property.
A bulletin board was built into the wall in the kitchen of a personal residence. If a buyer wants it, he should realize that the bulletin board:,will automatically remain with the property at the time of conveyance since it is real property.,must be listed on the deed.,must be exempted in the listing by the seller.,must be excluded from the personal property listed in the trust deed.,(Property) The whole purpose of the REPC is to transfer ownership of the real property identified at the beginning of the contract.  The built-in items are fixtures, therefore real property, therefore included in the sale.
S was three years into a five-year lease and wanted to move elsewhere. T was willing to sublet the property. Which is true?,S could increase the rent and make a profit.,T pays rent directly to the owner.,S has no further liability for rents or damages.,T is the only one who could be liable for damage to the property.,(Leases) This is a sublet.  S still has the primary liability and responsibility for rent payments to the lessor and for any damages.
