Which of the following is NOT one of the fiduciary duties of a property manager, acting under a contract between the broker and the property owner?,Caveat emptor,Loyalty,Obedience,Confidentiality,Caveat emptor means "Let the buyer beware" and applies when the buyer has no agency representation and is on his/her own to protect his/her position in the transaction.
Which thing on the list that follows would NOT be an item addressed in the property management contract between the broker and the owner?,The rents to be charged,The commission structure,The work schedule of the agents,The responsibilities of the agent,The rents charged to tenants will change from time to time, based on market conditions, supply and demand, and other considerations.  Therefore, they will not be specified in the contract to establish the agency relationship between owner and principal broker.
The non-disturbance clause found in the loan comes into play when and protects whom?,default on loan: lessee,default on lease: owner,eminent domain: lessor,loan is paid off: lessee,(Leases) This concept is also mentioned in the Finance class as it is contained in the loan document between the owner of the property and the lender.  If the loan contains the clause, it will also be mentioned in the lease between the owner and the tenant.
When the lease expired, Q, the lessee didn't leave as requested. Q kept giving excuses, saying a new residence was coming available soon. This creates:,Estate at sufferance,Tenancy in common,Estate at will,Periodic tenancy,(Leases) If Q offered rent for staying the extra time and the lessor took it, this would be a periodic tenancy.  Tenancy or Estate at will had no termination date, and tenancy in common is ownership.
Rent control laws have what effect?,Landlords don't like them as they must carry the burden of inflation.,They raise the general economy and everyone likes them.,Tenants like them because it means the lease has no termination date.,They benefit lessors and lessees equally.,Rent controls mean the rent cannot be raised, so the burden of inflation rests with the landlord.  Tenants love these laws; landlords hate them.
A particular parcel was zoned residential, single family and was surrounded by others zoned the same. That parcel was rezoned commercial so a convenience store could be built. This is an example of:,Spot zoning,Variance,Legal non-conforming use,Defeasible fee estate,Spot zoning will ONLY be a right answer if the question says that the zoning of that one parcel was changed to be different from that surrounding it.
For the purpose of property taxes, an appraisal is done and the value is determined by the:,County Tax Assessor,State Appraisal Board,Board of Equalization,County Tax Appraiser's Office,Board of equalization is a good one to remember, as that's where you appeal your property taxes.
The government took R's property for a highway and paid R fair market value. Which of the following gives the right for this type of action?,Eminent Domain,Condemnation,Regulation Z,RESPA,Condemnation is a step in eminent domain, but eminent domain is the right given to the government to acquire private property.
In Utah, property taxes become delinquent:,1-Dec,30-Nov,1-Jan,Nov-31,
In Utah, what is the statutory period for obtaining a prescriptive easement?,20 years,5 years,7 years,40 years,Seven years is adverse possession and losing water rights; 40 is marketable title; and five is nothing.
Which of the following is NOT a method for creating an easement?,A neighbor's use for 7 years,Prescription,Mutual Agreement,Implication,The wrong answer is referring to adverse possession.  All the other three are ways to create easements.
When a person builds an improvement that extends onto the property of a neighbor, it is considered a(n):,Encroachment,Easement,Injunction,Defeasance,An easement is a voluntary or involuntary right of use someone has on another person's property.  An injunction is a legal order to stop something. Defeasance is a clause in a loan.
An easement by prescription can best be described as:,An adverse use,An easement created by eminent domain,A right of way created for landlocked property,An easement recommended by a doctor for a sick land owner,Obtaining this kind of easement continues the use (against the interest of the actual owner) for the statutory period of time.  However, it does NOT lead to ownership.  That would be adverse possession.
When a person dies leaving no will and no heirs, the government will get the property by the process of:,Escheat,Quiet Title Action,Police power,Eminent domain,Police power is zoning; quiet title action is the final step for adverse possession; and eminent domain is the government taking ownership of private property.
An industrial complex was built near a residential area. In order to preserve the value of the residential area, which of the following would be the most likely to be employed?,Create a buffer zone by zoning restriction.,Zone the area between the two C1.,The local government would buy up the area in between by exercising eminent domain.,A zoning commission has no authority in such matters.,(Public & Private Ctrl) This is a simple one.  Just be sure to know the concept of buffer zones and what kinds of situations would call for such a thing, such as safety issues and protection of property values.
When the buyer and seller agree to extend the closing date, the real estate agent should:,prepare an addendum and have both parties agree to the change in writing,write a whole new contract.,make sure the buyer and seller shake hands to confirm the change.,explain that time is of the essence and the closing date cannot be changed.,It is not necessary to write a whole new contract, but remember it has to be in writing.  However, no whiteouts or lineouts; use an addendum.
Which of the following modifications can an agent make in a Real Estate Purchase Contract?,The agent can make no changes,Written consideration,Closing dates,Terms of the loan,The agent has no authority to make any changes.  The agent make type or write the changes on the addendum, but they do not make any difference until both parties sign and date it.  THEY make the changes.
On the settlement statement for a property closing on March 16th of the year, the proration of property taxes would appear as:,Debit seller, credit buyer,Debit seller, debit buyer,Credit seller, debit buyer,Credit seller, credit buyer,The seller owes taxes from 1/1 to 3/16.  To the seller it is a debit.  Think of debit=debt.  While not true in accounting terms, it's a good memory aid for settlement statements.  To the buyer (who will pay the taxes for the full year in November) it is a credit (think of "credit, you get it").
When an apartment building is sold, how should the renters' security deposits be handled on the HUD 1 statement?,They will be a debit to the seller and a notation in the buyer's credit section.,They will appear as a debit to the seller and a credit to the buyer.,They will be a debit to both since they belong to the renters.,They will not be noted in the settlement statement.,They cannot be a credit in the buyer's financial column or the buyer would be using other people's money to purchase the property.  They will be "noted" but will not be "computed."
You can deduct loan interest in which of the following circumstances?,On your house and your motor home.,Credit card debt used for improving your home.,The automobile used to travel to and from work.,Points on a home equity loan incorporated into the loan.,You can deduct home loan interest on loans for up to two homes.  You cannot deduct interest on personal debt.
In which of the following situations involving a 1031 would income taxes NOT have to be paid?,The exchange of a fourplex in the city for a small farm of equal value.,The exchange of a boat which can be a residence for a single family home.,Exchanging a duplex and a car for a triplex,The exchange of two properties resulting in one owner owing $5,000 less than before on the property loan.,(Taxation) The 1031 applies to "like for like" or real property for real property.  Personal property involved would be taxable and mortgage or debt relief is taxable.
Title insurance is paid:,only once, at closing.,annually.,monthly.,as a part of the mortgage payment.,That's it - once, at closing - memorize it!
Truth in Lending or Reg. Z includes all the following requirements EXCEPT:,Settlement Costs & You,Use of APR,Advertising restrictions,Disclosure of costs,"Settlement Costs & You" is a booklet required to be given to prospective borrowers under the Real Estate Settlement Procedures Act (RESPA), not Truth in Lending.
Which if the following requirements is specific to RESPA?,Borrower can see the HUD1 form 24 hours before closing.,A three-day right of rescission must be observed.,If a "trigger" term is used, all numbers must be used in advertising.,A historical example must be given if the loan is an ARM.,It is easy to mix up the details of Truth in Lending and RESPA.  The three wrong answers are all requirements of Truth in Lending.
Mrs. Brown has a contractual obligation to pay Ms. Larsen, her agent, a 6.5% brokerage fee for her services. Title costs are $1,300 and the seller is required to pay an extra $2,600 to cover carpet for the buyer. Assuming these are the only closing costs, what is the minimum selling price of the home if Mrs. Brown wants to net $150,000?,$164,598.93,$153,900.00,$164,327.80,$2,367,692.30,Yet another question where you must work backwards. The seller needs to net $150,000. To this we need to add our closing costs first. Sales agents are commissioned on the selling price of the home and not the price of the home plus the closing costs. That is why we add the closing costs first in this equation. At this point, if there was no agent commission owed, the minimum selling price would merely be the net required by the seller ($150,000) plus the closing costs ($3,900). Giving us a total of $153,900. The next step is more tricky... A common mistake is dividing by 6.5% using this calculation will get you a ridiculous number. The trick to this question is to remember that we are wanting what is net to the seller. In this case, we are going to take 100%, minus the 6.5% commission, for 93.5% which is left over for the seller. Now we can use the $153,900 divide this figure by 93.5% and you have the minimum selling price of the home.
Mrs. Hawkins has a contractual obligation to pay Mr. Cooper, her agent, a 5% brokerage fee for his services. The borrower has a loan of 80% LTV, and discount points of 2%. The seller's title costs are $1,500 and the seller is required to pay at closing an extra $750 to re-shingle the roof for the buyer. Assuming these are the only closing costs for the buyer and seller, what is the minimum selling price of the home if Mrs. Hawkins wants to net $65,000?,$70,789.47,$72,157.89,$71,971.05,$70,671.05,This is another question where you must work backwards. The information regarding the buyer's closing costs is irrelevant. The seller needs to net $65,000. To this we need to add our closing costs first (again the buyer's discount fees are not subtracted from what the seller is to receive and are not included in the seller's closing costs). Sales agents are commissioned on the selling price of the home and not the price of the home plus the closing costs. That is why we add the closing costs first in this equation. At this point, if there was no agent commission owed, the minimum selling price would merely be the net required by the seller ($65,000) plus the closing costs ($2,250). Giving us a total of $67,250. The next step is more tricky... A common mistake is dividing by 5% using this calculation will get you a ridonculous number. The trick to this question is to remember that we are wanting what is net to the seller. In this case, we are going to take 100%, minus the 5% commission, for 95% which is left over for the seller. Now we can use the $67,250 divide this figure by 95% and you have the minimum selling price of the home.
What is Radioactive, colorless, odorless, tasteless noble gas, occurring naturally in our environment as the decay of radium?,RADON,Natural Gas used,Gas contained in lead paint,None of the above,
Any offer without an Earnest Money Deposit is considered which of the following?,Valid,Unenforceable,Implied,Unilateral,Earnest Money is not a requirement to have a valid offer.  The confusion happens when we view the Earnest Money Deposit as the consideration in the contract.  The consideration is the promise to pay the sales price not the Earnest Money Deposit.
Bob the buyer has made an offer on Sam the seller's property.  That offer has been accepted.  Bob is working on finalizing his loan for the purchase as part of the contingencies of the agreement.  What kind of agreement exists between Bob and Sam?,Executory,Executed,Sale pending,Voidable,Because the contract is passed acceptance but not yet performed it is considered an Executory agreement.  Though we may refer to these as 'sale pending' the proper terminology is executory.
Which of the following do not have the ability to enter a contract?,An insane person,An illiterate person,An Alien,A deceased person,If the court determines that a person is insane they cannot enter a contract.  They are protected by law from harming themselves.  A deceased person can enter a contract if represented by the executor or an administrator.
Which of these situations does NOT cause a contract to become voidable?,Contract is not in writing,One of the parties is a minor,Menace,Duress,Contracts do not have to be in writing to valid. Those contracts covered by the statue of frauds must be in writing to be enforceable, but the contract may be valid.  This is a 'not' question so all other answers are TRUE the correct answer is the only FALSE answer.
If the court granted an action in your favor which of the following actions would best benefit you?,Writ of Execution,Les Pendens,Judgment,Attachment,In a Writ of Execution the court forces property to be sold to pay off the amount owed from a Judgment.  Les Pendens are a notice to the public of a legal action, attachments are motion granted as security in case the plaintiff does win the judgment.
A written real estate contract is best described as which of the following?,An Express Contract,Voidable,Based on contingencies,Unilateral because the buyer can cancel,Written contracts are categorized as express contracts because they use words to create the agreement.  Although the buyer has the rights to cancel based on certain potential contingencies that does not make the contract Unilateral.  Unilateral contracts are those that only one party is bound to based on the performance of the other.
The listing agent advertises his/her listing on the Multiple Listing Service as instructed by the seller at the agreed list price of $300,000.  A buyer offers $300,000 in writing with an earnest money deposit of $3,000.  Which of the following statements are true?,The seller can either accept, reject or counter the offer.,Because the offer is full price, the seller is obligated to accept the offer.,The seller must pay a commission and accpt the offer.,The listing broker must wait 72 hours before presenting the offer to give other buyers an opportunity to purchase the property.,(Listings & Options)  Listings are invitations for offers not Unilateral Contracts.  The seller is not obligated to accept or counter or even respond to any offer.  However, agents must present all offers promptly.  The seller may owe a commission based on the terms of the compensation section of the Listing Agreement.
The owner of a commercial property wants to sell.  The seller wishes to allow many brokerages the opportunity to sell the property. The seller should:,Execute an Open Listing with the brokerages he/she wishes to hire.,Sign a Net Listing.,Sign an Exclusive Right to Sell Listing.,Execute an Exclusive Agency Listing with each brokerage.,If a seller wishes to hire many brokerages to sell a property then they would enter into an Open Listing.  Remember this is only for those the brokerages that have entered the agreement NOT all brokerages.
When a listing is taken how does the agent confirm the amounts owed on the mortgages?,Order an Estoppel Certificate.,Have the title company verify balances.,The listing agent should personally contact all lien holders and verify balances.,The seller must list all lien amounts on the Seller's Proceeds Sheet.,Estoppel Certificate is a formal term describing the document that the lender provides accounting for the total amounts owed.  Agents should not be personally gathering this information.  Agents should advise their clients to personally verify the amounts on the Estoppel Certificate.
T would like to purchase property from F.  T sits with his agent and fills out a proper REPC.  Which of the following COULD NOT be used as an earnest money deposit?,A handshake and a verbal agreement to cut a check later.,A written IOU made out by T to F for $100.,T's personal property.,T's pet pig, Wilbur.,T may give anything of perceived value/consideration to the seller to complete a valid contract.  This includes personal property such as gold bricks, a check and yes even his pet Wilbur.  It does have to be escrowed though... where would you escrow Wilbur?
In order to begin the process of obtaining a VA loan, the applicant must provide what document?,Certificate of Eligibility,Certificate of Authenticity,Eligibility Waiver,Certificate of Reasonable Value,Past and present armed servicemen & women need to request a certificate of eligibility which is provided by the Department of Veterans Affairs.
A home was listed with the Speedy Seller brokerage.  It was later put under contract by an agent who worked for Buyers R Us brokerage.  Who could NOT be eligible to receive a commission check at closing?,The Buyer's R Us office assistant who held the open house.,Speedy Seller's associate broker.,The Buyers R Us agent who wrote up the purchase contract.,The Speedy Seller agent who listed the home.,Office assistants must be paid a regular wage which cannot be influenced on a per sale basis.  All other options could be eligible to receive a commission on the sale.
What could happen if a property owner does not pay his/her property tax?,It may take several years but, the home could be sold at a county auction to recoup the taxes due.,The home could be purchased by a third party who would be responsible first for the taxes due.,Nothing.  The local taxing authority would be forced to hold out indefinitely until the property owner was able to pay.,The property taxes will be paid once the property is sold, and only after when the other liens have been paid.,Not paying property taxes is a great way to get your property involuntarily taken away from you.  If the property owner does not pay, your local taxing authority will find someone more "willing."
A loan is amortized as though for 25 years, but is due sooner and paid off in a balloon payment.  This is known as a(n):,Partially amortized loan,Straight loan,ARM,Gap loan,When you think balloon, think partially amortized as well.  Partially amortized means that there will be some principal left to pay after all scheduled payments have been made.
Which government agency would be the best resource for flood plain determination?,FEMA,FHLMC,FHA,FNMA,The Federal Emergency Management Agency (FEMA).  This question tests  your knowledge of acronyms and can be tricky.
J made a $100 earnest money deposit on a 4-plex and wisely used a real estate agent to assist him with the paperwork.  The agent charged him a 2% commission.  The real estate agent wisely put the deposit in the brokerage's trust account.  The home later sold for $50,500.  How much will the escrow company pay the agent's brokerage?,$910,$1,010,$1,110,$900,The brokerage will be sent a check for the commission amount ($1,010) less the earnest money deposit ($100) held in the brokerage's trust account.  When the check is received, it is time for the brokerage to withdraw the earnest money from the trust account and claim it as commission.
An appraisal may be considered complete without which of the following?,Sales approach,Date,Signature,Property description,The appraiser may use any one or more of the three general approaches to value a property, but without the remaining items, the appraisal is considered incomplete.
Q is willing to seller finance the purchase of his home which he owns free and clear.  Q would be considered the:,Payee,Payor,Grantee,Leasee,The borrower would be the payor making the payments to the payee who is the seller and holder of a promissory note.
A loan is obtained for $30,000.  The loan calls for the principal to be paid in equal installments each month for 25 years.  The interest on the loan is 0.75% per month.  How much is the first payment?,$325,$1,425,$355,$2,350,Divide loan by 300 monthly payments ($100) and add first month's interest ($30,000*0.0075 = $225).
Which is not correct about PMI?,In order to remove PMI, the lender must receive a request from the borrower.,For "high-risk loans" lenders are required to automatically remove PMI when the loan balance reaches 77% of the original purchase price.,You may request PMI removal when the current loan balance equals 80% of the original purchase price or current appraised value, whichever is less.,To request cancellation of PMI, you must be current on your loan.,Once the loan balance has reached 78% of the original  purchase price or current appraised value, the lender is required to automatically remove the PMI payment.
The Federal Housing Administration is a mortgage lender allowing home ownership with little down payment.,False,True,,,FHA does not loan money.  Rather it partners with approved lenders to insure loan payments on higher LTV loans.
Which is true regarding FHA loans?,There are no prepayment penalties.,FHA would be used to originate a conventional loan.,FHA standards require a substantial amount as a down payment.,You will get an FHA loan regardless of your credit history.,FHA loans do not allow prepayment penalties on the insured loan.
An All-Inclusive Trust Deed is most closely related to all of the following EXCEPT:,Blanket mortgage,A wraparound mortgage,A Uniform Real Estate Contract,Subject-To loan,Although the terms all inclusive and blanket sound similar, a blanket mortgage is used to purchase two or more parcels of land.  The remaining options refer to the seller creating a new loan with a buyer while keeping the seller's original financing in place on a single property.
D wanted to buy a home from K, but wouldn't buy it unless the pool table came with it.  D and K decide that the pool table is personal property.  What contract would be the best tool for the pool table purchase?,Bill of Sale,Handshake and one hug,Pinky swear,REPC,The pinky swear and handshake/hug might have worked in the past, but modern real estate agents will tell you the bill of sale is the way to go for the purchase of all personal property.  If the purchase of real property is contingent on the acceptance of the bill of sale offer, it should be so noted on the REPC.
Recording is the same as closing.,False,True,,,Recording is a step in the closing process and typically the last.  Closing cannot happen without new ownership or new liens being recorded.
Which of the following are NOT typically paid in arrears?,Rent,Loan interest,11 months of property taxes,An agent's commission,Arrears is the opposite of paid in advance.  Rent is most always paid in advance and agents are typically paid after their service is rendered.  When you think of arrears, think "after the fact."
A deed of trust differs from a mortgage instrument in that a deed of trust allows the lender a more streamlined process to foreclose on a property and bypass the judicial process.,True,False,,,Well... that pretty much sums it up.  For more information, look in the mortgage law section.
Tim gets a 80% loan on a $100,000 property and is charged a 1 point origination fee.  He is also charged a $35 credit report fee and a $450 appraisal.  How much must Tim come to settlement with to then close the deal?,$21, 285,$1,285,$1,485,$100,485,Tim gets a $80K loan ($100K * 80%) and is charged 1 point or 1% ($800).  Add the down payment, origination fee, credit report fee, and appraisal fee: $20,000 + $800 + $35 + $450 = $21,285
When a person builds an improvement that extends onto the property of a neighbor, it is considered a(n):,Encroachment,Easment,Injunction,Defeasance,(Public & Private Ctrl) An easement is a voluntary or involuntary right of use someone has on another person's property.  An injunction is a legal order to stop something. Defeasance is a clause in a loan.
The primary product sold by a credit bureau is:,Information on the creditworthiness of an individual applicant.,Current income statistics on similar borrowers.,Pending judicial actions against the borrower.,Public records on all past criminal and civil hearings.,(Foreclosure & Credit)  A credit bureau is an agency that collects and sells information about the creditworthiness of individual consumers.
A large benefit of using a credit report to process an application is:,It is factual record of history allowing a quick and objective decision.,It provides a seasoned and expert opinion on the applicant's character.,The applicant can never determine what the loan decision was based on.,It may be the only way to verify an applicant's assets.,(Application & Underwriting)  A credit report is a factual record of a consumer's payment history as reported by their creditors.  It is used to assist lenders with quick and objective credit granting decisions.
