QUESTION,CORRECT ANSWER,INCORRECT ANSWER 1,INCORRECT ANSWER 2,INCORRECT ANSWER 3,EXPLANATION WHY CORRECT IS CORRECT
An investment property had a rate of return of 9.5%, and the NOI was $38,560. What was the value of the property?,$405,895,$367,225,$386,500,$428,506,Divide the NOI (LAST) by the 9.5% (RATE) to get the Value (FIRST).  Think of it as "Falue."
The Z family purchased their first home for $160,500. They got an 85% loan and paid two discount points. They had additional closing costs of $3,250. How much cash did they have to bring to settlement?,$30,053.50,$28,617.00,$25,450.25,$25,000.10,The loan is a percent, and so are the discount points, so two FRL's will be needed.  #1:  Purchase price x 85% to get the loan amount. #2: loan amount x 2% to get the points.  Step 3: subtract the loan from the purchase price for the down payment. Then just add to the down payment the points and the $3,250 in closing costs and you have your answer!
The commission split is 70/30, and the brokerage charges sellers 6%. The agent took home $8,500 last month for one sale. What was the selling price?,$202,381,$195,682,$198,434,$201,999,This is a two FRL question because it deals with two percents.  We start with the agent's portion as that's what we're given.  LAST is the agent's $8,500.  FIRST is the gross commission, our "I don't know."  RATE is 70% (remember the agent's split is the first number).  Divide the one below the line by the one above, or $8,500 by 70% to get the gross commission.  Then, same idea for the 2nd FRL.  LAST is the gross commission which you just computed.  FIRST is the selling price which we don't know.  RATE equals what is in L, and the rate that equals the gross commission is 6%.  Again, divide this one below the line by the one above for the answer.
The commission structure for the brokerage was 5% on the first $1,000,000 and 8% on the rest. The property sold for $1,345,000. How much was the commission?,$77,600,$67,250,$97,250,$174,850,One million x 5% = part of the commission - $50,000.  "The rest," or $345,000 x 8% = $27,600.  Add the two parts together for the correct answer.
Broker L listed a home that sold for the full price of $325,000. The contract called for a 6.5% commission. How much did Broker L make?,$21,125,$18,500,$20,250,$23,500,These are simple:  sales price multiplied by the commission percent for the commission dollars.  Or, commission dollars divided by the sales price for the commission %.
The buyers insisted they were not interested in a property that was less than 1.75 acres in size. A house on a property that was 465 feet by 643 feet looked great. How many acres does it have?,6.86,4.5,5.75,7.25,Length times width gives area:  465' x 643' = 298,995 sq. feet.  Divide by 43,560 (the number of feet in an acre).
M's back yard measured 56 feet deep by 82 feet wide. M is going to buy grass seed to plant a lawn. The package indicates how much is needed based on square yards. How many square yards are in M's back yard?,510,170,765,4,592,Length times width gives area:  56 x 82 = 4,592 square feet.  But, we need the answer in square yards. Since there are 9 square feet in a square yard, divide the 4,592 by 9.
The R's bought a home and obtained a loan for $128,000 at 7.25% interest per year, 30 year term. Their monthly P/I payment is $873.19. What is the total amount of interest they will pay over the full term of the loan?,$186,348.40,$314,348.00,$196,500.38,$278,400.00,This one is so easy!  P/I pmt. Of $873.19 times 360 payments = total payoff.  Subtract the original loan and the rest is the interest.
If the interest rate on a straight loan is 8% and the monthly interest payment is $650, what is the amount of the loan?,$97,500,$103,250,$88,750,$75,682,FIRST = loan; RATE = interest rate; LAST = annualized interest dollars.  Annualize the $650 and "divide the one below the line by the one above."
K wanted a property that was at least 3/4 of an acre in size. K liked the home on a property 434' by 289'. How many acres is this particular parcel?,2.88 acres,3 acres,1.76 acres,2.33 acres,Length x width will give you the area in square feet.  Divide that by the number of square feet in an acre (43,560) to determine the amount of area expressed as acreage.
The appraiser was determing the value of the property based on the cost approach. The outside dimensions of the home were 28' x 40' and the cost was $11.25 per square foot. His estimate of value was:,$12,600.00,$765.00,$1,530.00,$126,000.00,o get the number of square feet, multiply length times width.  Then merely multiply the total square feet by the cost per square foot.
The home to be insured had a value of $313,500. It was only insured for 85% of its value, and the cost for insurance was .65 per $100 of value for a three-year policy. How much was the premium for one year?,$577.36,$533.42,$625.00,$638.50,This problem has several steps:  1) Value x 85% to determine the value for insurance. 2) Divide that number by 100 (how many units of $100?)  3) Multiply that by .65 to get the cost of a three year policy. 4) Divide by 3 to get one year's premium.
Phil paid $2,500 in discount fees on his new loan. If the discount fees were 1.50% and Phil received a 90% LTV loan, what was the appraised value of the property?,$185,185.17,$186,186.17,$150,000.00,$149,999.99,Always have to go "bottom up" on this. Start with the $2,500 that Phil has paid. Divide by the 1.5% which gets you $166,666.66. Taking that answer and dividing by 90% will equal the appraised value. Hint: Writing the math steps going forward, will assist you in working backwards on these types of problems.
The Q's purchased some raw land for $35,000, thinking it would be worth a lot more in a few years. They sold it five years later for $42,000. What was their profit?,20%,15%,25%,35%,FIRST = bought; LAST = sold; RATE = selling price as a percent.  Remember question 6:  What rate equals L (thing that happened last?)  Bought for $35,000.  Sold for $42,000.  Divide the one below the line by the one above and you get 120%.  That is NOT 120% profit.  100% is getting back their investment, so 20% is the profit.
A lot was purchased as an investment for $10,500. It was sold a year later at a loss of 20%. What was the loss on the sale?,$2,100,$3,150,$8,400,$1,260,FIRST = purchase price; RATE = loss; LAST = loss in dollars.  Since you kow the two numbers above the line, multiply down for the answer.
A residence had an appraised value of $338,245 and an assessed rate of 65%. The taxes were $3,720.70. What was the tax rate?,0.017,0.2,0.02,0.01,Remember the "full house" formula, straight down in a line A,A,A,T,T (aces and tens).  From the top:  Appraised Value, Assessed Rate, Assessed Value, Tax Rate, Taxes due.  Just fill in the numbers where they go and multiply down or divide up.  In this case, multiply down to the Assessed Value, then divide up by dividing the tax amount by the assessed value.
If the assessed rate is 55%, the appraised value is $213,000, and the tax rate is 23 mills, how much are the property taxes?,$2,694.45,$2,650.78,$2,750.00,$2,875.00,(Property Tax and TI) Remember the "full house" formula, straight down in a line A,A,A,T,T (aces and tens).  From the top:  Appraised Value, Assessed Rate, Assessed Value, Tax Rate, Taxes due.  Just fill in the numbers where they go and multiply down or divide up.  In this case, multiply down to the Assessed Value, then remember if the tax rate is in mills, move the decimal three to the left:  .023.
All of the following actions terminate a listing EXCEPT:,Death of the listing salesperson,Death of the listing broker,Death of the principal,Abandonment by the broker,In a sole proprietorship, the listing is with the principal broker.  He dies, no more contract.  Subagent who took the listing dies, doesn't affect the contract.  If the other principal to the contract, the seller, dies, no more contract.  Abandonment by the broker could give the client legal cause to terminate the listing.
The buyers walked into a model home of a builder. The agent of the seller/builder had them sign an unrepresented buyer form. Which of the following applies?,Caveat emptor,Pur autre' vie,Habendum,Estoppel,Since the buyers are not represented it is "Buyer Beware."  Pur autr' vie is a life estate based on another's life; habendum is a clause in a deed. And estoppel applies to obtaining information about the loan or leases by court order, or the court affirming the existence of agency.
A house was listed for $180,000. The owners owe $130,000 on a first mortgage. The listing agent receives an offer for $120,000. The agent knows the closing costs will be $4,560 and attorney's fees $5,440. The agent should:,Present the offer to the owner.,Refuse to present the offer to the owner because he knows it is less than the owner owes.,Tell buyers they should pay the closing costs.,Present the offer to the sellers and tell them to reject the offer.,The listing agent represents the seller and has a duty to act in the best interest of the seller, but not to make the decisions for the seller.  All offers should be presented promptly.  The agent should never make the decision to not present an offer.
Which of the following would NOT be considered to have special agency?,A real estate agent given the responsibility to take care of all of the seller's real estate matters.,A real estate agent who has an exclusive right-to-sell listing on a home.,A real estate agent who takes a listing on a single family dwelling.,An agent who is given the responsibility to seek a ready, willing, and able buyer.,Special=specific agency: the agent is hired to perform specific duties. A universal agent takes care of all the affairs of the client.
K was hired to manage a large apartment building. He would be functioning as which type of agent?,General,Specific,Attorney in Fact,Universal,There are three types of agents:  specific - hired to perform defined actions; general - hired to use his/her expertise to meet the objectives of the client; universal - hired to do all things.  The process of being an attorney in fact could apply to any of the three.
Z listed the property. When the buyers expressed interest in seeing it, Z disclosed they would have no representation and the buyers agreed in writing. When writing the offer, the buyers asked Z what they should offer. Z responded, "Oh 93% of the listed price would be good." Which most applies?,This is ostensible agency between Z and the buyers.,This is limited agency and legal.,Z is properly representing the seller and obtaining an offer.,This would be a good suggestion for the agent to make.,Z has a contract to represent the sellers.  By suggesting actions to the detriment of his/her sellers and in the interest of the buyers, that could create implied or ostensible agency, and, therefore, undisclosed dual agency.
When the two parties agree in writing to have the agent act as a limited agent, most fiduciary duties still apply. But the principals are giving up something. Which best describes the change in fiduciary duties under limited agency?,The loyalty duty for single agents is replaced with neutrality.,The full disclosure duty has been expanded to include both parties.,Loyalty obligations now include both buyer and seller.,There are limitations on the duty of obedience required from the agent.,Limited agents have been "zapped" with the neutrality gun.  They must not reveal information which would give either party an advantage over the other.
Because of a zoning change, a factory was built that spewed smoke, dirt and dust over the subject property. This would be considered:,Economic obsolesence,Functional obsolesence,Physical depreciation,Eminent Domain,You may have been looking for "external obsolescence." External obsolescence includes factors outside the boundaries of the property and the control of the owner which have an economic impact. It could also be called political obsolescence.  Functional obsolescence is when it works, but nobody wants it!
The appraisal approach that determines value by adding the value of land to the depreciated replacement value of the improvement is the:,Cost approach,Income approach,Gross Rent Multiplier,Market data approach,This is the cost approach -- the only one to separate the value of the land.  What would it cost to rebuild, minus depreciation, then add the value of the land.
Fair market value is primarily based on:,the "willing buyer, willing seller" concept.,a cost of replacement.,government price controls.,assessed value.,Two things left out in this right answer are:  1) neither party under duress, and 2) sufficient time on the market.
Which best describes the first principle of appraising real property?,Highest and best use,Conformity,Anticipation,Neighborhood Cycle,This is one to just memorize.  This is the first "principle."  Don't confuse it with the first "step," which is to define the problem.
The lender wanted a very thorough appraisal report for the shopping mall being considered for financing. Which type of appraisal report would accomplish that?,Narrative,Check List,Survey,Letter Form,The "survey form" answer is not a real form.  The other three are.  The most extensive and one for commercial properties is the narrative report.
Progression and regression are considered "sub-principles" relating to overbuilding for an area, or purchasing the least expensive model home in a development of new homes. The main principle involved is:,Conformity,Contribution,Cycle of Change,Competition,If you don't know exactly what the three wrong answers mean, go back and do a little review.  They are each principles of appraising and can't be explained here in just a few key words.
What method of appraising would be most effective when appraising a vacant parcel of land?,Market data approach,Capitalization approach,Cost replacement approach,Income approach,The income approach and capitalization need income, not vacant land.  Cost replacement works only for the improvement to the land. So market data, or comparison approach is the only one that is applicable.
Which of the following is NOT an approach to appraising?,Plottage,Cost,Income,Comparison,Three of the choices are the three possible approaches to an appraisal.  Plottage is combining two parcels and selling them as one, making the value greater than just the two combined values.
People who execute a document are referred to as:,Signatories,Executors,Testators,Notary Republics,To execute a document refers to the placing of signatures therefore puts the contract into effect. Executor is the person who carries out the will; "testator" wrote the will; a notary public verifies your signature. A person who signs any document is the signatory.
When selling real estate, contracts must be in writing:,According to the Statute of Frauds,If advised by the real estate agent.,Unless the deed is to be recorded,If agreed to by the buyer and seller,Simple fact:  to be enforceable a contract for the sale of real property must be in writing.
After an offer to purchase real property has been signed and presented, how long does the offeror have to withdraw the offer?,Until the offer has been accepted.,Three days following the presentation.,Twenty-four hours following presentation.,Once the offer has been signed, it cannot be withdrawn until the offeree accepts, rejects, counters or the stated time period for acceptance has elapsed.,The longer version of the right answer would be until the offer has been accepted and that acceptance has been communicated to the offeror.
Which of these contain only the essential elements of a real estate contract?,legal purpose, capacity, mutual consent, in writing,in writing, capacity, acknowledgment,mutual consent, legality, consideration, recordation,in writing, consideration, notarization,Remember the Roman numerals:  M,C,C,L for any contract.  Mutual agreement, mutual assent, mutual assent, meeting of the minds -- convenient they all start with "M."  Consideration; capacity/competency; legal purpose.  For a real estate contract, we also need it to be in writing. Each of the wrong answers has an item that doesn't belong on the list.
Which of the following choices would NOT be considered to be valuable consideration, and, therefore, meet the requirement for a valid contract.,Lifelong friendship,Performing a service,Promissory note,A parcel of land with back taxes due,Three choices are considered of value by law: service, a promise to pay, and land.  Friendship, while a thing of great value to most of us, is good consideration only in terms of contracts.  Good consideration is not good enough!
In selling their home, the sellers are willing to let the buyers take over their existing loan. The lender agrees. But the sellers want to be sure they have no further liability for that loan amount. They could ensure the lack of liability with a(n):,Novation,Assignment,Fiduciary agreement,Release of lien,Novation is an assignment "with a twist."  If A is assigning his/her position in a contract with B to X, the new contract is between X and B.  If B agrees to this, it is a novation and A is relieved of all liability.
In which of the following situations is a special warranty deed most likely to be used?,After a death, the executor grants the property to the devisee.,A standard sale of an existing residence.,A lease with an option to buy.,In a divorce the husband gives up his rights to the home.,(Deeds & Transfer) This deed has very limited warranties and only for the time the grantor owned or had responsibility for it.  Bank owned properties, foreclosure sales and executor's sales use them.
A person who receives a gift of real property in a will is called the:,Devisee,Grantor,Testator,Mortgagor,(Deeds & Transfer) The gift is a devise, the deceased is the devisor, the grantor, the testator; and the lucky recipient is the devisee.
Which of the following relates to a deed:,Exceptions and reservations,Personal property,Lien,Tax assessment,(Deeds & Transfer) Anything being held back and not getting conveyed with the deed is an exception or reservation and would be in the habendum clause.
Zachary received a warranty deed after purchasing a property. He saw that his name had been misspelled. Which of the following documents would he execute to correct the title?,Quit Claim Deed,General Warranty Deed,Special Warranty Deed,Bargain and Sale Deed,(Deeds & Transfer) A quit-claim deed is used to clear clouds from the title.  The misspelled name is just such a cloud.
The main purpose of Title III of the Americans with Disabilities Act is to:,provide equal access to goods and services.,make sure a handicapped person has a place to live.,provide employment opportunities for the disabled.,provide adequate parking spaces for those with disabilities.,Title III of this Act is about access to goods and services.  The Fair Housing Act has to do with housing issues.
At a closing on a loan, the APR is higher than the interest rate because:,the borrower paid some extra costs to obtain the loan.,the lender paid some costs that contributed to the loan.,the interest rate is calculated on a 360 day calendar.,interest rates fluctuate between the application for the loan and the closing date.,The APR is a math calculation that incorporates into the first year interest on the loan the other costs involved in originating the loan.
An apartment building with 12 units has 6 covered parking spaces, all of which are assigned, a handicapped tenant moves in. Which of the following is true?,The handicapped person must be given a space as soon as one becomes available if it is necessary for his enjoyment of the property.,The owner must add additional space if one isn't available.,The owner must make provisions so the handicapped person can have a parking place.,Under no circumstances does a parking space have to be provided if the owner doesn't want to do it.,In this kind of question, a key to watch for is the words, "full enjoyment of the premises."  It does not say to take something away from another tenant for the new tenant.
Which of the examples below is NOT an exception to the requirements of the Fair Housing Laws?,Condo complex that requires that everyone who buys or lives there must be at least 45 years old.,A church-owned apartment building that has always rented only to members, and lets anyone join their church,An owner of a triplex who lives in one unit and rents out the other two.,The owner of a single family home renting a bedroom, and who advertises: "Females only.",One tiny thing in one of the answers makes it not an exception to the law's requirements.  The age is 62, not 45, for senior housing.
Which of the following is the best definition of the term "redlining?",Refusing loans in certain areas because of its ethnic makeup.,Spreading rumors of minorities moving into the development.,showing homes in a largely white area to people of color.,Refusing to rent to an unmarried couple who want to live together.,Spreading rumors is "blockbusting."  The answer about the white people fits the definition of "steering."  All the activities described in the answers are illegal and in violation of Fair Housing laws.
What does a mortgagor NOT have to pay?,Life insurance,Title insurance,Hazard insurance,Property taxes,(Mortgage Law) Did you remember who the mortgagor is?  The borrower, who is giving a mortgage as collateral for the loan.  The only answer that is not required for the borrower to pay for is life insurance.
What does a VA loan have that an FHA loan does not?,An LTVR of 100%,A right of reinstatement,No prepayment penalty,Discount points,(Loan Types) The 100% applies to the appraisal or purchase price, whichever is less.  It is also dependent upon the amount of eligibility the veteran has as shown in the Certificate of Eligibility.
Discount points could best be described as:,A way to raise the effective yield of the loan.,An additional security deposit given to the bank to secure the loan.,Money charged to originate the loan.,A reward the bank gives for referring a new borrower.,The correct answer here is from the viewpoint of the lender's advantage.  The advantage to the borrower is paying discount points buys down the interest rate, and hence the payment itself, permanently.
A short-term loan to help you buy the new house before the sale on the old one has closed would be most like a(n):,Bridge loan,Open-end loan,Purchase money loan,Wraparound loan,A bridge or gap loan bridges the gap between getting the money out of the old house and purchasing the new one. An open-end loan works like a credit card, a purchase money loan is when the seller is the lender, and a wraparound loan is also a purchase money loan, but it has a difference.  In a "wrap" the seller is wrapping a new 2nd loan with the buyer around an existing loan.
Which of the following is most like the "or more" clause in a loan:,Prepayment privilege clause,Graduated payment clause,Index clause,Reappraisal clause,(Loan Types) You can pay the required payment, or that much and more.  The other three choices are different ways of setting up the terms for increasing the required payment as time passes. The reappraisal option would apply to lease, not loan, payments.
An up-front cost the lender charges to the borrower, usually a percent of the loan amount, that generates profit to the lender and factors in the lender's cost of getting money.,Origination fee,Document prep fee,Title insurance fee,Discount points,Discount points are paid by the buyer (unless the seller agrees to pay them) to permanently buy down the interest rate.  Title costs are for settlement and title insurance. Document prep fees cover just what it says!
Which of the following entities is only in the secondary mortgage market, and not in both primary and secondary?,GNMA (Government National Mortgage Association),Banks,Insurance companies,Private individuals,GNMA, FNMA, FHLMC only function in the secondary money market, buying loans already in place.
R wanted to buy Q's home, but being new on the job could not qualify. Q agreed that with $15,000 down, Q would carry a loan for the remainder of the purchase price, amortized over 30 years at 8% interest. This is a(n):,Purchase money mortgage,Wraparound loan,Double contract, and illegal,Discounted loan or note,Seller financing = purchase money mortgage.  In this case it is not also a wraparound as the new loan does not incorporate an existing loan.
L agreed to carry a 2nd in the sale of the home. It was for $20,000, 9% interest, 30 years, payment of $160.92 per month. However, it had a five year call when the buyer would pay off the balance of $19,176. How would you describe this loan arrangement?,Partially amortized,Fully amortized,Wraparound,Discounted,Fully amortized would be paid off by the end of the term; wraparound is a seller carryback involving an underlying loan; and discounting a loan would only come into play if L sold the 2nd to an investor for less than its face value.
What is the name of the principal base and meridian in the state of Utah?,Salt Lake,Wasatch,Utah,Uintah,The Uintah is the secondary base and meridian for Utah, but the principal one is Salt Lake.
A property description that uses angles and degrees is referred to as:,Metes and bounds,An informal description,Government survey,Lot, block, and plat,A street address is an example of an informal description.  The other three answers are the correct names of the three methods for legal descriptions.
