George Smith, who owns his property fee simple, grants a three-year lease to Tom Green. During the second year of the lease, George sells the property to Ned Gray. What happens to the lease when the sale closes?,The lease remains in effect with Mr. Gray and Mr. Green.,It terminates.,It must be negotiated between Gray and Mr. Green, the leasee.,Property cannot be sold and title transferred to a new owner when a lease is in effect.,(Leases) From the bundle of rights the tenant has the bundle of possession until the lease contract terminates.  The new owner has that particular bundle "in reversion."  It will come back at the end of the lease.
A lessee agreed to pay property tax and hazard insurance as well as rent. This lease is:,Net lease,Percentage lease,Gross lease,Proprietary lease,(Leases) With a gross lease the owner would pay the taxes and insurance.  A tenant with a percentage lease pays a percentage of the profits along with the base lease.  A proprietary lease is the right to occupy in a co-op granted because of purchasing stock in the corporation which owns the property.
In a listing contract, the seller agrees to:,consider offers on the property.,sell the property.,sell only if a full priced offer comes in.,fix any appliances that are broken.,By signing the listing the seller is not agreeing up front to sell, but to consider all offers and decide from there whether to sell.
An exercised option is called a:,Bilateral Contract,Express Contract,Unilateral Contract,Is not considered a contract,An option is unilateral (a promise for a performance), as only the seller/optionor has made any promise.  Once the option is excersized, it is now a purchase contract and is bilateral.
Under an agreement of sale, the seller is considered the:,Vendor,Mortgagor,Devisee,Grantee,One who sells or offers to sell is a vendor.  The one who buys or offers to buy is the vendee.  The mortgagor is the borrower who signs the mortgage as collateral for the loan. The grantee is the recipient of the deed.
What is the risk to a lender who accepts a deed in lieu of foreclosure?,They would accept the deed subject to any junior liens.,The original borrower may be represented by a lawyer.,There must be a foreclosure to make the deed valid.,A deed in lieu of foreclosure is considered illegal.,(Mortgage Law) This is a perfectly legal arrangement, but carries risks for the lender.  It is sometimes called a "friendly foreclosure."
A uniform land contract could best be described as a:,Installment Contract,Trust Deed and Note,Real Estate Purchase Contract,Listing,(Mortgage Law) Its four names are:  Uniform Land Sales Contract, Installment Sales Contract, Land Contract, and Contract for Deed. It is used in seller financing.
The borrower used a document which gave the trustee power of sale as the security for the loan to buy the home. What document would contain that power:,Deed of Trust,Mortgage,Trustee's Deed,Uniform Real Estate Contract,(Mortgage Law) This security instrument may be called a Deed of Trust or a Trust Deed:  same thing.  A mortgage is also a security instrument, but does not convey the power of sale and therefore requires court action.  A trustee's deed is the deed given to the winning bidder who buys property at a foreclosure sale under a trust deed. A Uniform Real Estate Contract is a document used sometimes in seller financing.
Z went to a trust deed foreclosure sale on an investment property that looked like a good deal. There were other investors, but Z won the bid. Which of the following would Z expect to receive.,Trustee's Deed,Deed of Trust,Trust Deed,Sheriff's Deed,(Mortgage Law) Deed of Trust and Trust Deed are the same thing:  the collateral document the borrower signed.  A sheriff's deed applies to foreclosure under a mortgage.
When dealing with a land contract, or Uniform Real Estate Contract, which of the following choices is NOT one of the available remedies for default?,Change the locks and hold their belongings as security for back payments owed.,Use the steps of foreclosure to get them out.,Treat them as renters and evict them.,Hire an attorney to collect the back amounts owed.,(Mortgage Law) Changing the locks, etc. is not a legal option.  All of the other three are options for the owner.
Under a mortgage foreclosure, K made the highest bid and got the property. Within 24 hours K had paid the full amount to the sheriff. What would K receive?,A certificate of sale,A special warranty deed,A bargain and sale deed,A quit claim deed,(Mortgage Law) K will not receive the actual deed until the six month statutory period of redemption has passed and the defaulting borrower was unable to redeem the property. The other answers are all different types of deeds.
Q decides to rent a single family home. The agreement prohibits the tenant from assigning or subletting. Which right in the Bundle of Rights does the tenant NOT share in?,Disposition,Quiet Enjoyment,Use and Control,Possession,The tenant has the bundle of Quiet Enjoyment, and Posession, as well as a few sticks from Use and Control, but does not have sticks from the bundle of Disposition.
H gives a life estate to her mother's doctor, which states that the doctor will have the property for as long as "Mom" is alive. Mom is very healthy, but the doctor is now dead. What happens?,The property goes to the doctor's heirs,The property goes back to H.,Mom gets the property.,Mom's heirs get the property,This is a life estate Pur Autre' Vie (based on the life of another).  The doctor (holder of the life estate) is dead, but what about Mom, upon whose life it is based?  If she's still alive, the life estate is still alive and will go to the doctor's heirs.
Which of the following requirements must be met for a REIT (real estate investment trust) to be legal?,100 members: 90% paid as profits,1,000 members: all funds paid out as profits,Any number of members and 95% paid out as profits,1,000 members: 96% paid as profits,A REIT prevents double taxation.  But it must meet the minimum requirements for number of members and the amount of profits distributed.
When a remainder estate is involved, what owner interest is involved?,Life Estate,Joint tenancy,Community property,Ownership in severalty,Severalty means one owner.  Joint tenancy and community property are co-owners held as a fee estate.  A life estate right ends with the person's life, and then it passes to the remainderman.
Two people buy a property together. If one dies, full ownership will automatically belong to the other. This is called:,Joint tenancy,Tenancy in common,Tenancy at sufferance,Community property,Joint tenancy and tenancy by the entirety have full rights of survivorship.  The joint tenancy takes precedence over the terms of the will.
M and N own a property together as tenants by the entirety. Which of the following is true about their ownership?,Neither M nor N can mortgage the property without the consent of the other.,M can sell his/her share without the consent of N.,If M sells his/her interest, the new owner would become a joint tenant with N.,If N dies before M, N's interest can be willed to N's heirs.,Tenants by the entirety have survivorship, as joint tenants do.  But there are two big differences.  Under tenancy by the entirety, the parties must he married, and neither can sell nor encumber without permission of the other.
Easements, rights of ingress and egress and other rights and privileges which pass with the title of real estate are called:,Appurtenances,Habendum,Emblements,Licenses,(Property) Appurtenant means anything attached to the property, either physically (the house) of by deed (the easement). Habendum is a clause in a deed; emblements are crops nurtured in the year of the sale; and license is an interest in real property which is temporary and involves no ownership.
D purchased a lot and subsequently built a house, planted a tree and built a garage/workshop separate from the house. Which term describes this process?,Accession,Severance,Hypothecation,Encroachment,(Property) Severance is the opposite of accession, like cutting the tree down.  Hypothecation is using something as collateral without giving up possession, an an encroachment is someone else invading your territory.
Under the law of emblements, which of the following situations is true?,The seller deeds the property to the buyer but has rights to the crop.,The buyer gets the land, the seller gets the farm house.,The buyer gets everything, and after harvesting the crop, gets the profits from it.,Everything goes to the buyer and the seller has no further rights to anything on the property.,(Property) The seller has the rights to the crops in the year of the transaction --it is the return on their investment.
Which of the following falls into the category of appurtenances?,improvement,personal property,acceleration,privilege,(Property) An appurtanence is anything attached to the land itself, such as improvements like a house, or rights in the deed.  Both would transfer to a new owner.
Which of the following best describes a fixture?,That which is attached without losing its identity.,A crop nurtured in the year of the transfer.,Physical items used in a business that may or may not be attached.,Bolted down barber chair.,The crops reference is the definition of emblements; the other two wrong answers are referring to trade fixtures.
The renters hadn't paid rent for the past two months. The landlord was sick of it and ready to act. Which of the choices below is appropriate and legal?,Initiate an Unlawful Detainer action in court.,Have the locks changed so they can't get back in.,Put their belongings out on the street until rent is collected.,Immediately call the sheriff to put them out.,(Leases) Having the sheriff put them out is the last step of the eviction process.  The unlawful detainer is the first step.  The other two answers are illegal.
A lessee had two years to go on a five-year lease. Which would release the tenant from further obligation to pay rent after they voluntarily moved out?,Constructive eviction,Actual eviction,Habendum,Habeus Corpus,(Leases) Constructive eviction is when  tenants "evict" themselves for cause (landlord won't repair the heater, replace glass in windows, etc.).  Actual eviction is where the landlord evicts the tenant; habendum is a clause in a deed; and habeus corpus is a legal term not relevant to real estate.
A property manager, in fulfilling his/her duties to the principal, would want to make sure there was an insurance policy in place to cover:,Liability,E & O,Workers' Compensation,Mortgage,E & O insurance is for a brokerage; workers' compensation for employees; and mortgage insurance on a loan.
At the beginning of each month the lessee gives, and the lessor takes the rent. This best describes:,Periodic tenancy,Joint tenancy,Tenancy at will,Tenancy by the entirety,(Leases) Two of these "tenancies" describe ownership and two describe leasing situations.  Joint tenancy and tenancy by the entirety are ownership.  Tenancy at will is of uncertain duration and can be cancelled at will by either lessor or lessee.
What term best describes a situation where the lessor collects rents from the tenants and pays expenses out of those rents?,Gross lease,License estate,Participation lease,Net lease,(Leases) I'm the landlord:  it's gross that I have to take money out of the rents I collected to pay the bills!  Net lease is where the tenant pays some or all of the expenses.
In a graduated lease contract, which of the following would NOT be a means to determine future rent amounts?,Use of an ARM,Reappraisal,Index,Escalation clause,(Leases) An ARM is an adjustable rate mortgage.  All the other answers can be used to calculate raises in the rent.
K and N owned homes in the same subdivision, bought the same year and the same size lot and type of floor plan. K found out N's taxes were $480 less. Where would K appeal to get lower taxes?,The Board of Equalization,The Board of Adjustment,The Division of Real Estate,The County Recorder's Office,(Property Tax and TI) The Board of Adjustment is where you would go to get a variance if you wanted to do something different than allowed by zoning.  You want your taxes to be equal to your neighbor's, so you go to the Board of Equalization.
Which kind of title insurance would provide the most protection for the buyer of the property?,Extended Owner's policy,Plain Language policy,ALTA Lender's policy,Standard policy,(Property Tax and TI) There are many types of insurance policies, some you may know of as their brand names.  But of the choices given here, "extended" tells you it has the most coverage for the owner -- similar to the coverage in the lender's policy.
Which of the following is NOT a means of regulating land?,Resolutions passed by the local Board of Realtors,Building codes,Deed restrictions,Zoning,A professional organization of any kind does not have legal rights to put restrictions on the use of land.
Which of the following would require a variance?,A 9,000 square foot lot where zoning regulations require 10,000 square foot lots.,A church in an area zoned for residential properties.,An area between two varying types of zoning classifications to give protection to one of the areas.,A business in an area that had recently been rezoned to residential.,A variance (to vary from) comes after certain zoning requirements are in place.  It is the right to do something different and be legal about it. The business answer will be a legal non-conforming use as the use was their first.  The area between two types of zoning would be a buffer.
The purpose of a document receipt is to verify that:,all parties have received fully signed copies of the Real Estate Purchase Contract.,all involved agents and brokers have signed the purchase agreement.,both the buyer and seller received all appropriate documents at the closing.,the buyer signed all documents involved with the loan.,A document receipt is just what it says:  a receipt for documents.  In the choices here, the only one applicable references the REPC.  A person signing a document should receive a copy with all signatures.
The buyers made an offer; the sellers accepted it by signing the sales contract. Then the buyers decided they wanted to extend closing a week later. What should the agent do?,Write an addendum with the new date and have both parties sign.,Get the sellers permission, then notify the buyers of their agreement.,X out the old date and write in the new date on the contract. Give eveveryone a copy.,Rewrite the contract with the new date and get everyone's signatures.,No whiteouts, no x-outs, no initials -- no matter how small the change, use an addendum.
Which of the following is NOT a true statement about the settlement statement?,The seller's loan payoff will be a debit to the seller, a credit to the buyer.,It is to account for all money involved in the transaction,It will note if monies were paid up front.,Buyer total closing cost appear on the back and front of the statement.,The seller's loan payoff has nothing whatsoever to do with the buyer's financial issues in this transaction.  It will not appear at all on the buyer's side.
When considering income tax issues, Which of the following relates to the phrase: "Two of the last five years"?,$250,000 exemption,Interest deduction,Home office deduction,$550,000 exemption,(Taxation) For the $250,000 exemption ($500,000 for husband and wife) to apply, they must have lived in and owned the property for two of the last five years.
Which of the following is NOT true regarding the income tax concept of depreciation.,A vacant lot can be depreciated when rented to people for gardens.,It does not result in "getting out of" paying taxes.,Straight line method is the only one allowed for real property.,Cost recovery is another term for depreciation,(Taxation) No matter what you do with it, land cannot be depreciated.  Period.  End of discussion!
A purchaser should obtain which one of the following to be sure there are no encroachments:,Survey,Title insurance,Declaration of offset,Encroachment protection policy,Title insurance basically covers things that would be found in the records.  An encroachment would not be in the records. The best protection would be a survey, or one of the expanded title policies might cover encroachments.
Which of the following statements is true of both Truth in Lending and RESPA regulations?,They cover single to four-family dwellings.,APR must be used in advertising.,The booklet Settlement Costs & You must be given.,They cover loans to small businesses.,Be sure you study carefully to know the specific requirements of each of these laws, and where they are the same.  Their purpose is the same:  disclosure to the public of the costs of borrowing money.
If a property was worth $233,087 two years ago and it appreciated at the rate of 6% each year, how much is it worth now?,$261,897,$259,633,$261,057,$263,942,Don't say:  two years at 6% = 12%, so $233,087 x 12%.  It appreciated 6% each year (in other words, it compounded).  So original value x 6% and add the two (or multiply by 106% for one step).  That gives you the value after one year.  Take that new value and do it again.
A property had a net operating income of $3,430. If the property had a value of $22,000, what was the rate of return of this property?,15.59%,1.56%,0.16%,6.41%,This is a cap rate, capitalization, or rate of return question.  FIRST = Value (Falue); RATE = rate of return; LAST = NOI (remember it must be an annual number).  We have the value at the top, the NOI at the bottom, so we divide the one below the line by the one above the line.
A home listed with ABC Realty sold for $168,500. If the closing costs were $3,825 and the commission was $11,795, what was the rate of commission?,7%,6.80%,7.16%,7.25%,Commission problems have three elements:  Selling price, % commission and $ commission.  If you have any two, you can compute the third.  For FRL:  FIRST=Selling price; RATE=% commission; LAST=$ commission.  Divide the $ of commission ($11,795) by the Selling price ($168,500) to get the answer. (Divide the one below the line by the one above.)
The commission structure for the brokerage was 5% on the first $1,000,000 and 8% on the rest. The property sold for $1,345,000. How much was the commission?,$77,600,$67,250,$97,250,$174,850,One million x 5% = part of the commission - $50,000.  "The rest," or $345,000 x 8% = $27,600.  Add the two parts together for the correct answer.
The loan on the property was for 85% of its appraised value. The interest on the loan was 9%. The interest in the first payment was $1,205 . What was the appraised value of the property?,$189,020,$195,383,$200,555,$215,769,Whoa, this one throws a lot at you!  Start at the end:  we want the appraised value, but the loan was only 85% of that.  So first we have to arrive at the loan.  Remember:  Loan is FIRST, the interest % is RATE, and the interest dollars are LAST (and must be annualized to match the rate).  So, $1,205 x 12 = $14,460 annualized interest.  Divide the one below the line by the one above (interest rate) and get $160,666.67 for the loan.  Now 2nd FRL, appraised value came FIRST, 85% is the RATE, and the loan is LAST.  "Divide the one below the line by the one above the line" or the loan by 85% to get the appraised value.
Sam obtained an interest only loan on the property for 65% of its appraised value. The interest rate was 12.5%. The first semi-annual interest payment was $6,000. What was the appraised value?,$147,692.31,$62,400.00,$77,384.62,$126,001.10,Whoa, this one throws a lot at you!  Start at the end:  we want the appraised value, but the loan was only 65% of that.  So first we have to arrive at the loan.  Remember:  Loan is FIRST, the interest % is RATE, and the interest dollars are LAST (and must be annualized to match the rate).  So, $6,000 x 2 = $12,000 annualized interest.  Divide the one below the line by the one above (interest rate) and get $96,000 for the loan.  Now 2nd FRL, appraised value came FIRST, 65% is the RATE, and the loan is LAST.  "Divide the one below the line by the one above the line" or the loan by 65% to get the appraised value.
A single family investment property had a GRM of 92.68. The monthly gross rents were $1,800. What is the value of the property based on the GRM?,$166,824,$135,850,$148,500,$152,320,You need to remember the formula:  Selling price divided by gross rents = GRM.  In this case we are given the GRM and rents, so we will modify the basic formula to the gross rents multiplied by the GRM for the value.
A straight loan has monthly interest payments of $738.02. The interest rate is 7.67%. What is the amount of the principal?,$115,465.97,$118,934.89,$124,362.08,$130,698.98,All loan problems:  Loan is FIRST interest is RATE and interest payment is LAST.  Just remember, interest % is annual so you may have to adjust the interest dollars to be annual because R equals L.  So take the $738.02 monthly interest times 12 to annualize it.  Then "divide the one below the line by the one above the line" or $8,856.24 divided by 7.67% = the principal (original loan or current balance).
M obtained a loan for $80,000 at 9 1/2% interest for thirty years. The payment is $672.68 including principal and interest. How much interest would M pay over the full term of the loan?,$162,164.80,$242,266.01,$228,000.00,$308,000.00,This one is so easy!  P/I pmt. Of $672.68 times 360 payments = total payoff.  Subtract the original loan and the rest is the interest.
M's back yard measured 56 feet deep by 82 feet wide. M is going to buy grass seed to plant a lawn. The package indicates how much is needed based on square yards. How many square yards are in M's back yard?,510,170,765,4,592,Length times width gives area:  56 x 82 = 4,592 square feet.  But, we need the answer in square yards. Since there are 9 square feet in a square yard, divide the 4,592 by 9.
The buyers insisted they were not interested in a property that was less than 1.75 acres in size. A house on a property that was 465 feet by 643 looked great. How many acres does it have?,6.86,4.5,5.75,7.25,Length times width gives area:  465' x 643' = 298,995 sq. feet.  Divide by 43,560 (the number of feet in an acre).
A sporting goods store had a lease agreement to pay 1.75% on all income over $56,000 a month gross in addition to the base rent they paid of $2,000. Last year they paid $56,500 in rent. What was their total gross income?,$2,529,143,$1,368,321,$1,857,143,$1,954,330,This is a percentage rent problem.  Before doing the FRL, there's a preliminary step: Paid rent minus base rent.  So, $56,500 paid minus $24,000 base = $32,500 extra rent.  FIRST = extra income; RATE = 1.75%; LAST = extra rent ($32,500).  Divide the one below the line by the one above and you get the extra income.  Add that to the $56,000 base income to get gross income.
The owner wants to net $40,000 upon selling the property. The commission is 7%, there will be $2,500 in closing costs, plus a $450 fee to the attorney. What does the property need to sell for to get the owner $40,000 net?,$46,182.80,$50,125.00,$200,555,$215,716,Always have to go "bottom up" on this.  Work from the top down and you'll be close, but no cigar!  FIRST is the selling price, our "I don't know" so the question mark goes there.  LAST is the net.  But the seller doesn't only need the $40,000, but also enough to cover closing costs and the attorney.  So $42,950 is what he really needs to net.  For LAST, what % equals the "net?"  It sells for the magic 100%, 7% comes out for commission, so 93% equals the net.  Divide the one below the line by the one above, or $42,950 by 93% to get the answer.
Tom wants to clear $90,000 when he sells his property. He must pay a 7% commission, $250 in closing cost, and $300 to the attorney who assisted in the transaction. What should he sell the property for?,$97,365,$96,850,$97,324,$96,774,Always have to go "bottom up" on this.  Work from the top down and you'll be close, but no cigar!  FIRST is the selling price, our "I don't know" so the question mark goes there.  LAST is the net.  But the seller doesn't only need the $90,000, but also enough to cover closing costs and the attorney.  So $90,550 is what he really needs to net.  For LAST, what % equals the "net?"  It sells for the magic 100%, 7% comes out for commission, so 93% equals the net.  Divide the one below the line by the one above, or $90,550 by 93% to get the answer.
An agent from a buyer brokerage represents the:,buyer,seller,is a neutral facilitator,seller and buyer,It's not rocket science!  A buyer brokerage takes no listings, but only represents buyers; therefore, no limited agency.
K has an agreement as a property manager for an owner. This would create which of the following relationships or positions?,Fiduciary,Trustee,Director,Mortgagor,It creates an agency relationship, which is a fiduciary one.
Broker L lists a home and offers subagency through the MLS. Broker S takes a buyer to the house and then writes an offer to purchase. Broker L has never met the buyer. Broker S has never met the seller. Broker S does not have a written contract with the buyer. Which is true?,Both Broker L and Broker S are agents of the seller.,Broker L is the agent of the buyer.,Broker L is the subagent of the buyer.,Broker S is the agent for the buyer and seller.,It helps a lot with these types of questions to diagram the players on paper. Utah says a licensee must represent one or both of the parties in a real estate transaction.  Since it says S does not have a contract with the buyer, and it does say the listing was published across the MLS, both brokers represent the seller - L as agent, S as subagent.  NOTE:  It doesn't matter for the test that no one does it this way anymore.  It is a legal concept and still can be done this way.
